MCQ,Choices,Correct
Who coined the term 'machine learning'?,a: Donald Hebb | b: Raytheon Company | c: Arthur Samuel | d: Tom M. Mitchell,c
What field of study focuses on exploratory data analysis through unsupervised learning?,a: Natural Language Processing | b: Computer Vision | c: Machine Learning | d: Data Mining,d
When was the earliest machine learning model introduced?,a: 1949 | b: 1950s | c: 1960s | d: 1981,b
Who proposed the early mathematical models of neural networks to come up with algorithms that mirror human thought processes?,a: Walter Pitts | b: Warren McCulloch | c: Tom M. Mitchell | d: Donald Hebb,a
What is the mathematical foundation of machine learning provided by?,a: Mathematical Optimization | b: Data Mining | c: Computational Statistics | d: Pattern Recognition,a
